{
  "artifact_type": "state-lineage",
  "mode": "state-aware",
  "species_profile_sha256": "0000000000000000000000000000000000000000000000000000000000000000",
  "individual_morphology_sha256": "0000000000000000000000000000000000000000000000000000000000000000",
  "identity_contract_sha256": "0000000000000000000000000000000000000000000000000000000000000000",
  "era_contract_sha256": null,
  "form_contract_sha256": null,
  "appearance_variant_sha256": null,
  "state_snapshot_sha256": "0000000000000000000000000000000000000000000000000000000000000000",
  "scene_context_sha256": "0000000000000000000000000000000000000000000000000000000000000000",
  "visual_projection_sha256": "0000000000000000000000000000000000000000000000000000000000000000",
  "asset_render_spec_sha256": "0000000000000000000000000000000000000000000000000000000000000000",
  "lineage_sha256": "0000000000000000000000000000000000000000000000000000000000000000",
  "visual_authority_sha256": null,
  "visual_evidence_bundle_sha256": null
}
