{
  "artifact_type": "state-lineage",
  "mode": "stateless",
  "species_profile_sha256": null,
  "individual_morphology_sha256": null,
  "identity_contract_sha256": null,
  "era_contract_sha256": null,
  "form_contract_sha256": null,
  "appearance_variant_sha256": null,
  "state_snapshot_sha256": null,
  "scene_context_sha256": null,
  "visual_projection_sha256": null,
  "asset_render_spec_sha256": null,
  "lineage_sha256": "6478db57c11b5b46db30592b50137c2a953d7f0c781ee143f42514a80631d648",
  "visual_authority_sha256": null,
  "visual_evidence_bundle_sha256": null
}
